{
  "pml": "0.1",
  "meta": {
    "id": "laterite",
    "title": "Laterite to metal extraction",
    "subtitle": "Winning nickel, cobalt and manganese from low-grade laterite ore by bioleaching.",
    "functionalUnit": "1 kg of recovered critical metal (Al + Mn + Ni + Co) from the Mn-oxide concentrate bioleach",
    "boundary": "Cradle-to-gate. Starts at mined laterite ore arriving wet at the plant, ends at recovered metal in the bioleach liquor. Excludes mining itself and downstream refining.",
    "currency": "$",
    "source": "Reproduces standalone/laterite-lca-tea.html (Balance, Energy GWP-MnO w allocation, Energy GWP-MnO no-alloc, Energy and GWP-BFL and TEA-price MnO BFL worksheets).",
    "notes": [
      {
        "id": "q_mozley_double",
        "level": "quirk",
        "title": "Mozley stream counted twice",
        "text": "The Mn-oxide concentrate is worked out as attrition feed minus fines minus heavies (72 - 69 - 0.6 = 2.4 kg/h). The 1.7 kg/h sent to Mozley separation is never subtracted, so it is inside the concentrate as well as in its own stream and the attrition block puts out 73.7 kg/h from 72 kg/h in. The attrition energy uses a different remainder (72 - 69 - 1.7 = 1.3 kg/h) for the coarse size fraction. Both are kept exactly as the spreadsheet has them.",
        "nodes": ["mnox", "attr_frac_coarse", "attr_closure.error"]
      },
      {
        "id": "q_split_constants",
        "level": "quirk",
        "title": "Split fractions are frozen x/360 ratios",
        "text": "Every size fraction is a fixed ratio of the feed taken from the 360 kg/h reference case (20/360, 268/360, 72/360, 69/360, 1.7/360, 0.6/360). Changing the feed scales every stream together; the split itself never moves and does not respond to ore properties.",
        "nodes": ["ref_feed", "bfl", "bcl_stor", "bcl_attr", "bcl_fine", "bcl_mozl", "heav"]
      },
      {
        "id": "q_co_si",
        "level": "quirk",
        "title": "Cobalt recovery uses the silicon grade",
        "text": "In both composition tables the cobalt recovery formula points one row down and multiplies the Co recovery (87.2% and 79.1%) by the Si wt% (0.4% and 1.0%) instead of the Co wt% (2.3% and 0.164%). The 'wt% used by recovery' column shows the grade actually applied; it is reproduced so that the graph matches the published numbers.",
        "nodes": ["mnox_comp.co.wt_rec", "mnox_comp.co.n", "bfl_comp.co.wt_rec", "bfl_comp.co.n"]
      },
      {
        "id": "q_bioleach_size",
        "level": "quirk",
        "title": "Bioleach CAPEX size fed in t/h against a kg/h base",
        "text": "Seven equipment rows are scaled on their feed in kg/h against a 33.5 t/h (33,500 kg/h) reference. The bioleaching row divides its feed by 1000 first (0.0224) and compares that with an 18.5 t/h reference written as 18,500, so its cost is scaled on a size ratio that is 1000 times too small.",
        "nodes": ["capex.bioleach.size", "capex.bioleach.cost"]
      },
      {
        "id": "q_alloc",
        "level": "quirk",
        "title": "LCA is mass-allocated, TEA is not",
        "text": "The climate footprint charges the Mn-oxide concentrate only with its mass share of each energy step (drying, crushing, attrition). The operating cost charges the whole coarse line plus the whole bulk-fine line, unallocated. The two panels therefore describe different systems.",
        "nodes": ["ealloc", "noalloc_elec", "elec_tjy"]
      },
      {
        "id": "q_third",
        "level": "quirk",
        "title": "Co-product GWP divided equally by three",
        "text": "The per-metal footprints for Mn, Ni and Co are the total concentrate GWP divided by each metal's recovered mass and then by 3, a flat equal split across three co-products that ignores aluminium and does not sum back to the total.",
        "nodes": ["coprod_n", "gwp_mn", "gwp_ni", "gwp_co"]
      },
      {
        "id": "q_na2so4",
        "level": "quirk",
        "title": "Na2SO4 default is 0 on load, 60 after reset",
        "text": "The dashboard's Na2SO4 field is 0 g/L when the page loads (the value the published numbers and the recorded baseline reflect) but its reset button sets it to 60 g/L. The graph uses 0 so that it matches the page as shown.",
        "nodes": ["na2so4"]
      },
      {
        "id": "q_dry_twice",
        "level": "quirk",
        "title": "Dry basis applied twice",
        "text": "The feed entered is already dry, yet the bioleach volume, the metal recoveries and the BFL disk-milling energy multiply the concentrate and BFL flows by (1 - moisture) again. Only 1.8 of the 2.4 kg/h of concentrate is leached and recovered from.",
        "nodes": ["mnox_dry", "bfl_dry", "liquor_mn", "liquor_bfl"]
      },
      {
        "id": "q_mw_mn",
        "level": "quirk",
        "title": "Manganese molar mass taken as 57",
        "text": "The BFL manganese grade converts MnO to Mn with 57/(57+16); the true molar mass of Mn is 54.94.",
        "nodes": ["bfl_comp.mn.mw_metal", "bfl_comp.mn.wt"]
      }
    ]
  },

  "stages": [
    { "id": "mass", "title": "Mass balance", "verb": "Do mass balance",
      "tryIt": "The size fractions are fixed ratios of the feed, so click the ore stream and change the throughput: everything scales together and the split never moves. Now raise the moisture from 25% to 40% — the dry flows are untouched, but look at what happens to the drying energy in the next step." },
    { "id": "lci", "title": "Life cycle inventory", "verb": "Build inventory",
      "tryIt": "Drop the bioleach solid concentration from 50 to 20 g/L and re-run. More water per kilogram of ore means more slurry to heat, and the heat demand climbs sharply for no extra metal." },
    { "id": "lcia", "title": "Impact assessment", "verb": "Run impact assessment",
      "tryIt": "Look at which of the four contributors dominates. Then cut the FeSO₄ dose to the Mn oxide bioleach from 25 to 10 g/L and re-run to see how much of the footprint is one reagent." },
    { "id": "capex", "title": "Capital cost", "verb": "Estimate CAPEX",
      "tryIt": "Every unit is scaled with the six-tenths rule from a 33.5 t/h reference plant. Multiply the ore feed by ten and watch capital rise by roughly six times, not ten — that gap is the economy of scale." },
    { "id": "opex", "title": "Operating cost & revenue", "verb": "Cost the operation",
      "tryIt": "Set the raw laterite price to zero, as if the ore were a mine waste stream rather than a purchased feed. For a low-grade resource that single assumption often decides the whole case." },
    { "id": "dcf", "title": "Profitability", "verb": "Run cash flow",
      "tryIt": "Compare the break-even metal price against the $18.50/kg assumed. If break-even sits above the market price, the process needs either a richer ore or a cheaper feed." }
  ],
  "stepCopy": {
    "scope": { "tryIt": "This case has four saleable metals from one ore, so the functional unit lumps them together. Splitting the burden between co-products instead — allocation — would give four different numbers from exactly the same plant." },
    "interpret": { "tryIt": "Ore grade, moisture and feed price dominate here. Note that two of the three are properties of the deposit, not choices the designer gets to make." }
  },

  "components": {
    "fe": { "label": "Fe" },
    "al": { "label": "Al" },
    "mn": { "label": "Mn" },
    "cr": { "label": "Cr" },
    "mg": { "label": "Mg" },
    "ni": { "label": "Ni" },
    "co": { "label": "Co" },
    "si": { "label": "Si" },
    "o":  { "label": "O", "mw": 16, "source": "Oxygen, used to convert the BFL oxide assays to metal grades." }
  },

  "params": {
    "ncl":   { "label": "NCL raw material (dry)", "stage": "mass", "dim": "mass_hour", "unit": "kg/h", "default": 360, "range": [50, 5000], "hit": "ncl_dry",
               "source": "Balance L3. Dry mass of nickel-cobalt laterite ore fed to the plant." },
    "moist": { "label": "Moisture content", "stage": "mass", "dim": "fraction", "unit": "%", "default": 25, "range": [0, 60], "hit": "oven",
               "source": "Balance L12. Free water in the as-mined ore; all of it has to be evaporated." },
    "ref_feed": { "label": "Reference feed of the Balance sheet", "stage": "mass", "dim": "mass_hour", "unit": "kg/h", "default": 360, "editable": false,
               "source": "Balance L3 basis (360 kg/h) from which every split fraction is taken.", "notes": ["q_split_constants"] },

    "solidc": { "label": "Bioleach solid concentration", "stage": "lci", "dim": "concentration", "unit": "g/L", "default": 50, "range": [5, 200], "hit": "bioleach",
               "source": "Balance O3. Pulp density in both bioleach reactors." },
    "na2so4": { "label": "Na₂SO₄ dose — BFL", "stage": "lci", "dim": "concentration", "unit": "g/L", "default": 0, "range": [0, 200], "hit": "na2so4_bfl",
               "source": "Balance O5. Reagent added to the bulk fine laterite bioleach.", "notes": ["q_na2so4"] },
    "feso4b": { "label": "FeSO₄ dose — BFL", "stage": "lci", "dim": "concentration", "unit": "g/L", "default": 3, "range": [0, 60], "hit": "feso4_bfl",
               "source": "Balance O6. Iron source for the bulk fine laterite bioleach." },
    "feso4m": { "label": "FeSO₄ dose — Mn oxides conc.", "stage": "lci", "dim": "concentration", "unit": "g/L", "default": 25, "range": [0, 100], "hit": "feso4_mn",
               "source": "Balance O7. Iron source for the Mn oxide concentrate bioleach; the dominant reagent burden." },

    "t_cold":  { "label": "Ambient temperature", "stage": "lci", "dim": "temperature", "unit": "°C", "default": 25, "editable": false, "source": "Energy sheet D4." },
    "t_oven":  { "label": "Oven drying temperature", "stage": "lci", "dim": "temperature", "unit": "°C", "default": 100, "editable": false, "source": "Energy sheet." },